{
  "specversion": "1.0",
  "id": "d6c3abc336fcdd4d6194ada43205a4504fd6d3169b53dc72f63e963882f00829",
  "source": "gateway://example.com/consent",
  "type": "fr.linagora.twalk.consent.state.changed.v1",
  "time": "2026-09-17T10:05:00Z",
  "subject": "assistant",
  "datacontenttype": "application/json",
  "dataschema": "https://schemas.twalk.dev/cloudevents/v1/consent.state.changed.schema.json",
  "network": "whatsapp",
  "consent": "granted",
  "data": {
    "subject": {
      "type": "persona",
      "id": "assistant"
    },
    "old_state": "unset",
    "new_state": "granted",
    "scope": {
      "networks": ["whatsapp"]
    },
    "occurred_at": "2026-09-17T10:05:00Z",
    "actor": "@michel:example.com"
  }
}
